{
 "format": "ime-lexicon-user-bundle/1",
 "producer": {
  "component": "lexicon",
  "version": "0.1.0",
  "employee_id": "lexicon"
 },
 "exported_at": "2026-10-28T10:01:49Z",
 "source": {
  "schema": "ime-lexicon-user/1",
  "store_id": "e281bb56-f44d-4855-b144-6111c48ca80c",
  "revision": 1,
  "base": null
 },
 "compatibility": {
  "min_reader": "1.0",
  "max_reader": "1.x"
 },
 "learning": {
  "enabled": false
 },
 "entries": [
  {
   "count": 500,
   "first_seen": "2026-10-28T10:01:49Z",
   "id": "w-7db0c3f55c78e949",
   "kind": "custom",
   "last_seen": "2026-10-28T10:01:49Z",
   "pinyin": "zhi'ruo'ci'ku",
   "source": "custom",
   "text": "芷若词库"
  },
  {
   "count": 1,
   "first_seen": "2026-10-28T10:01:49Z",
   "id": "w-5ee2dcc3736d01e4",
   "kind": "learned",
   "last_seen": "2026-10-28T10:01:49Z",
   "pinyin": "ci'ku'zeng'qiang",
   "source": "commit",
   "text": "词库增强"
  },
  {
   "count": 1,
   "first_seen": "2026-10-28T10:01:49Z",
   "id": "w-3897389148b41d47",
   "kind": "learned",
   "last_seen": "2026-10-28T10:01:49Z",
   "pinyin": "qi'lin'cao'zuo'xi'tong",
   "source": "commit",
   "text": "麒麟操作系统"
  }
 ],
 "entry_count": 3,
 "checksum": {
  "algorithm": "sha256",
  "scope": "format, compatibility, entries and entry_count; excludes checksum, producer, exported_at, source, learning",
  "value": "7a8978f755183f59b4af13426ee4d7dce89549d397b09675f83d343ecd13807d"
 }
}
